[
  {
    "metric_id": "edit_survival_rate",
    "name": "Edit-survival rate",
    "family": "quality",
    "definition": "Share of engine-drafted text that survives, unchanged in substance, from the first drafted revision to the submitted document.",
    "formula": "surviving_drafted_chars / total_drafted_chars, computed per section then weighted by section length; substance-preserving whitespace and formatting edits excluded.",
    "source": {
      "streams": ["feedback_event", "run_log"],
      "fields": ["feedback_event.before", "feedback_event.after", "feedback_event.kind", "artifact.revision_n", "target.section_id"],
      "filters": ["run.mode == 'live'", "pursuit reached submission"]
    },
    "grain": "section",
    "unit": "ratio",
    "direction": "higher_is_better",
    "dimensions": ["section_type", "claim_tier", "engine_version", "pursuit_type"],
    "comparability": {
      "hold_constant": ["kb_snapshot", "config_digest", "engine_version", "model_pins", "prompt_version"],
      "excludes_run_modes": ["replay", "regression_bench", "dry_run"],
      "annotate_on_change": true
    },
    "reliability": {
      "min_n": 5,
      "estimated": false,
      "known_failure_mode": "Rises when reviewers disengage as easily as when quality improves. Read next to review_rounds_to_accept and reviewer_hours_per_proposal — survival up with hours flat is disengagement, not improvement."
    },
    "target": { "value": 0.7, "comparator": ">=", "basis": "baseline", "set_after_observation": true },
    "views": ["system_owner", "practice_leadership"],
    "owner": "system_owner",
    "status": "active"
  },
  {
    "metric_id": "edit_reason_mix",
    "name": "Edit reason mix",
    "family": "quality",
    "definition": "Distribution of reviewer edits across reason codes: factual, tone, length, structure, strategy, compliance, other.",
    "formula": "count(edits by reason) / count(all edits), per period.",
    "source": { "streams": ["feedback_event"], "fields": ["feedback_event.edit_reason", "feedback_event.kind"], "filters": ["kind == 'edit'"] },
    "grain": "period",
    "unit": "percent",
    "direction": "context_only",
    "dimensions": ["section_type", "claim_tier", "engine_version"],
    "comparability": { "hold_constant": ["engine_version", "prompt_version"], "excludes_run_modes": ["replay", "regression_bench", "dry_run"] },
    "reliability": {
      "min_n": 20,
      "known_failure_mode": "Diagnostic, not evaluative — a shift toward 'tone' is a voice-spec problem and a shift toward 'factual' is a KB problem. They need opposite fixes, so the mix matters more than the total."
    },
    "views": ["system_owner"],
    "owner": "system_owner",
    "status": "active"
  },
  {
    "metric_id": "review_rounds_to_accept",
    "name": "Review rounds to acceptance",
    "family": "quality",
    "definition": "Number of full review passes a section goes through before a reviewer accepts it.",
    "formula": "max(revision) at accept event, per section; reported as median and 90th percentile.",
    "source": { "streams": ["feedback_event"], "fields": ["feedback_event.revision", "feedback_event.kind"], "filters": ["kind == 'accept'"] },
    "grain": "section",
    "unit": "count",
    "direction": "lower_is_better",
    "dimensions": ["section_type", "actor_role"],
    "comparability": { "hold_constant": ["engine_version", "prompt_version"], "excludes_run_modes": ["replay", "regression_bench", "dry_run"] },
    "reliability": { "min_n": 5, "known_failure_mode": "Compare against the WP-Zero baseline round count; without it the number has no scale." },
    "views": ["system_owner", "practice_leadership"],
    "owner": "system_owner",
    "status": "active"
  },
  {
    "metric_id": "tier1_block_rate",
    "name": "Tier-1 block rate",
    "family": "quality",
    "definition": "Share of drafted sections containing at least one Tier-1 bindable claim that the Claim Auditor blocked pending verification.",
    "formula": "sections_with_tier1_block / sections_drafted.",
    "source": { "streams": ["run_log"], "fields": ["validation.check", "validation.result", "validation.claim_tier", "run.totals.tier1_blocks"], "filters": ["run.mode == 'live'"] },
    "grain": "run",
    "unit": "percent",
    "direction": "context_only",
    "dimensions": ["section_type", "engine_version"],
    "comparability": { "hold_constant": ["kb_snapshot", "engine_version", "prompt_version"], "excludes_run_modes": ["replay", "regression_bench", "dry_run"] },
    "reliability": {
      "min_n": 5,
      "known_failure_mode": "A falling block rate is equally consistent with a better Fact Sheet and with an auditor that stopped catching things. Only interpretable beside poison-set recall from the eval suite (E2)."
    },
    "views": ["system_owner"],
    "owner": "system_owner",
    "status": "active"
  },
  {
    "metric_id": "tier1_waiver_rate",
    "name": "Tier-1 waiver rate",
    "family": "ops_safety",
    "definition": "Share of Tier-1 blocks released by human waiver rather than by verification.",
    "formula": "blocks_waived / blocks_raised.",
    "source": { "streams": ["run_log"], "fields": ["validation.waived_by", "validation.waiver_reason"], "filters": ["run.mode == 'live'"] },
    "grain": "period",
    "unit": "percent",
    "direction": "lower_is_better",
    "dimensions": ["actor_role", "section_type"],
    "comparability": { "hold_constant": ["engine_version"], "excludes_run_modes": ["replay", "regression_bench", "dry_run"] },
    "reliability": { "min_n": 5, "known_failure_mode": "A high waiver rate means the blocking control has become a click-through. A waiver with an empty reason string is an alert, not a data point." },
    "target": { "value": 0.15, "comparator": "<=", "basis": "aspirational", "set_after_observation": true },
    "alerting": { "alert": true, "condition": "waiver recorded with empty or boilerplate waiver_reason", "severity": "serious", "route_to": "system_owner" },
    "views": ["system_owner"],
    "owner": "system_owner",
    "status": "active"
  },
  {
    "metric_id": "false_gap_rate",
    "name": "False-gap rate",
    "family": "quality",
    "definition": "Share of gaps raised to a human where the answer was in fact retrievable from the KB at the time of the run.",
    "formula": "gaps_resolved_from_existing_kb / gaps_raised.",
    "source": { "streams": ["run_log", "feedback_event", "eval_results"], "fields": ["gap.gap_id", "gap.resolution", "kb.empty_result", "kb.cards_returned"] },
    "grain": "period",
    "unit": "percent",
    "direction": "lower_is_better",
    "dimensions": ["section_type", "engine_version"],
    "comparability": { "hold_constant": ["kb_snapshot", "engine_version"], "excludes_run_modes": ["replay", "regression_bench", "dry_run"] },
    "reliability": { "min_n": 10, "known_failure_mode": "Over-flagging trains reviewers to click past gap pings, silently disabling the invention guard (decision E3)." },
    "target": { "value": 0.05, "comparator": "<=", "basis": "eval_bar" },
    "views": ["system_owner"],
    "owner": "system_owner",
    "status": "active"
  },
  {
    "metric_id": "gap_resolution_hours",
    "name": "Gap resolution time",
    "family": "efficiency",
    "definition": "Elapsed hours from a gap ping being sent to a human answer being recorded.",
    "formula": "gap.answered_at - gap.pinged_at, reported as median and share unanswered past the escalation threshold.",
    "source": { "streams": ["run_log"], "fields": ["gap.pinged_at", "gap.answered_at", "gap.resolution"], "filters": ["run.mode == 'live'"] },
    "grain": "pursuit",
    "unit": "hours",
    "direction": "lower_is_better",
    "dimensions": ["actor_role", "section_type"],
    "comparability": { "excludes_run_modes": ["replay", "regression_bench", "dry_run"] },
    "reliability": { "min_n": 5, "known_failure_mode": "Median hides the tail; the unanswered-past-escalation share is the number that predicts a stalled pursuit." },
    "alerting": { "alert": true, "condition": "gap unanswered past escalation threshold (decision N4)", "severity": "warning", "route_to": "pursuit_lead" },
    "views": ["pursuit_lead", "system_owner"],
    "owner": "pursuit_lead",
    "status": "active"
  },
  {
    "metric_id": "red_team_score",
    "name": "Red-team score",
    "family": "quality",
    "definition": "Adversarial reviewer-agent score on the annotated draft, on the calibrated rubric.",
    "formula": "Mean rubric score across scored sections; judge model and rubric_id recorded with every value.",
    "source": { "streams": ["run_log", "eval_results"], "fields": ["validation.check", "validation.score"], "filters": ["validation.check == 'red_team'"] },
    "grain": "run",
    "unit": "score",
    "direction": "higher_is_better",
    "dimensions": ["section_type", "engine_version"],
    "comparability": { "hold_constant": ["engine_version", "judge_model", "prompt_version"], "excludes_run_modes": ["replay", "regression_bench", "dry_run"], "annotate_on_change": true },
    "reliability": { "min_n": 5, "estimated": true, "known_failure_mode": "An uncalibrated judge is a random number generator with a confident tone (E5). The series breaks at any judge-model change — segment, never splice." },
    "views": ["system_owner"],
    "owner": "system_owner",
    "status": "active"
  },
  {
    "metric_id": "engine_cost_per_pursuit",
    "name": "Engine cost per pursuit",
    "family": "cost",
    "definition": "Direct model API spend for all runs belonging to a pursuit.",
    "formula": "sum(agent_call.cost_usd) over the pursuit's live runs; equals sum of run.totals.cost_usd.",
    "source": { "streams": ["run_log"], "fields": ["agent_call.cost_usd", "run.totals.cost_usd"], "filters": ["run.mode == 'live'"] },
    "grain": "pursuit",
    "unit": "usd",
    "direction": "lower_is_better",
    "dimensions": ["model_tier", "section_type", "stage"],